{
  "name": "accepted-hint-5",
  "description": "힌트 5단계. 독립 풀이 0.25 이며 '최근 독립 풀이' 로 세지 않는다.",
  "input": {
    "sourceEventId": "submission:1",
    "skillCode": "BFS_GRID_TRAVERSAL",
    "skillWeight": 1.0,
    "judgeStatus": "ACCEPTED",
    "hintLevel": 5,
    "solutionViewed": false,
    "occurredAt": "2026-09-05T10:00:00Z",
    "evidenceType": "PROBLEM_SUBMISSION",
    "solveSeconds": null,
    "expectedSolveSeconds": null,
    "algorithmSelection": null,
    "mode": "NORMAL",
    "problemCode": "P02_GRID_TRAVERSAL",
    "tleCause": null
  },
  "expected": {
    "evidenceId": "ev_bde7e2628ad7a59ed015122f",
    "sourceEventId": "submission:1",
    "skillCode": "BFS_GRID_TRAVERSAL",
    "evidenceType": "PROBLEM_SUBMISSION",
    "occurredAt": "2026-09-05T10:00:00Z",
    "weight": 1.0,
    "observed": {
      "concept": null,
      "recognition": null,
      "implementation": 0.65,
      "independent": 0.25,
      "retention": null,
      "speed": null
    },
    "sourceConfidence": 1.0,
    "context": {
      "problemCode": "P02_GRID_TRAVERSAL",
      "judgeStatus": "ACCEPTED",
      "hintLevel": 5,
      "solutionViewed": false,
      "independentAttempt": false,
      "reviewSucceeded": null,
      "daysSinceLast": null,
      "verdict": null
    }
  }
}
