{
  "name": "recognition-exam-mode",
  "description": "유형을 숨긴 모드에서만 recognition 을 관측한다.",
  "input": {
    "sourceEventId": "submission:1",
    "skillCode": "BFS_GRID_TRAVERSAL",
    "skillWeight": 1.0,
    "judgeStatus": "ACCEPTED",
    "hintLevel": 0,
    "solutionViewed": false,
    "occurredAt": "2026-09-05T10:00:00Z",
    "evidenceType": "PROBLEM_SUBMISSION",
    "solveSeconds": null,
    "expectedSolveSeconds": null,
    "algorithmSelection": "CORRECT",
    "mode": "EXAM",
    "problemCode": "P02_GRID_TRAVERSAL",
    "tleCause": null
  },
  "expected": {
    "evidenceId": "ev_bde7e2628ad7a59ed015122f",
    "sourceEventId": "submission:1",
    "skillCode": "BFS_GRID_TRAVERSAL",
    "evidenceType": "PROBLEM_SUBMISSION",
    "occurredAt": "2026-09-05T10:00:00Z",
    "weight": 1.0,
    "observed": {
      "concept": null,
      "recognition": 0.9,
      "implementation": 0.9,
      "independent": 0.95,
      "retention": null,
      "speed": null
    },
    "sourceConfidence": 1.0,
    "context": {
      "problemCode": "P02_GRID_TRAVERSAL",
      "judgeStatus": "ACCEPTED",
      "hintLevel": 0,
      "solutionViewed": false,
      "independentAttempt": true,
      "reviewSucceeded": null,
      "daysSinceLast": null,
      "verdict": null
    }
  }
}
