{
  "name": "timezone-offset",
  "description": "오프셋이 붙은 시각도 그대로 보존한다. 재계산이 실제 시각으로 정렬한다.",
  "input": {
    "sourceEventId": "submission:1",
    "skillCode": "BFS_GRID_TRAVERSAL",
    "skillWeight": 1.0,
    "judgeStatus": "ACCEPTED",
    "hintLevel": 0,
    "solutionViewed": false,
    "occurredAt": "2026-09-05T19:00:00+09:00",
    "evidenceType": "PROBLEM_SUBMISSION",
    "solveSeconds": null,
    "expectedSolveSeconds": null,
    "algorithmSelection": null,
    "mode": "NORMAL",
    "problemCode": "P02_GRID_TRAVERSAL",
    "tleCause": null
  },
  "expected": {
    "evidenceId": "ev_bde7e2628ad7a59ed015122f",
    "sourceEventId": "submission:1",
    "skillCode": "BFS_GRID_TRAVERSAL",
    "evidenceType": "PROBLEM_SUBMISSION",
    "occurredAt": "2026-09-05T19:00:00+09:00",
    "weight": 1.0,
    "observed": {
      "concept": null,
      "recognition": null,
      "implementation": 0.9,
      "independent": 0.95,
      "retention": null,
      "speed": null
    },
    "sourceConfidence": 1.0,
    "context": {
      "problemCode": "P02_GRID_TRAVERSAL",
      "judgeStatus": "ACCEPTED",
      "hintLevel": 0,
      "solutionViewed": false,
      "independentAttempt": true,
      "reviewSucceeded": null,
      "daysSinceLast": null,
      "verdict": null
    }
  }
}
